category,product_name,slug,description,price_zar,sale_price_zar,sku,stock_quantity,length,texture,colour,material,tags,image_file_names,video_file_names,featured
Bundles,Straight 20 Inch Human Hair Bundle,straight-20-inch-human-hair-bundle,"Premium 20 inch straight human hair bundle in natural black, designed for a smooth polished install with soft movement and a luxury finish.",850,,HBP-BUN-STRAIGHT-20,12,20,Straight,Natural Black,Human Hair,"Bundles, Straight, Human Hair, 20 Inch","C:/Users/Charmique/Pictures/Camera Roll/Hair By Paris/Product images/CJRT1383791_1776014720470/1_ff8c880c-9851-434f-b94c-d08e5d97cf4c.jpg",,yes
Bundles,Body Wave 22 Inch Human Hair Bundle,body-wave-22-inch-human-hair-bundle,"Premium 22 inch body wave human hair bundle in natural black, made for soft volume, a glossy finish, and elegant installs.",950,,HBP-BUN-BODYWAVE-22,10,22,Body Wave,Natural Black,Human Hair,"Bundles, Body Wave, Human Hair, 22 Inch",,,yes
Wigs,Example HD Lace Straight Wig,example-hd-lace-straight-wig,"Premium HD lace wig with a sleek straight finish and natural hairline.",2999,,HBP-WIG-001,10,24,Straight,Natural Black,Human Hair,"Wigs, HD Lace, Straight",example-wig-front.jpg;example-wig-side.jpg,,yes
Bundles,Example Brazilian Body Wave Bundle Set,example-brazilian-body-wave-bundle-set,"Soft body wave bundles with full volume and natural shine.",1899,1699,HBP-BUN-001,15,"20,22,24",Body Wave,Natural Black,Human Hair,"Bundles, Body Wave, Human Hair",example-bundles.jpg,,yes
Closures & Frontals,Example HD Lace Frontal,example-hd-lace-frontal,"HD lace frontal designed for a seamless melt and polished install.",1299,,HBP-FRO-001,8,20,Straight,Natural Black,Human Hair,"Frontals, HD Lace",example-frontal.jpg,,no
Hair Accessories,Example Champagne Silk Bonnet,example-champagne-silk-bonnet,"Soft champagne silk bonnet for protecting installs and natural hair.",299,,HBP-ACC-001,25,One Size,,Champagne,Silk Blend,"Accessories, Silk, Hair Care",example-bonnet.jpg,,no
